{"GUID":"AkKsEQACHt+eytMKHO6owg==","MATNR":"HZ-WPH","MAKTX":"Phosphorus White","WERKS":"0001","LGORT":"0002","LGOBE":"Cold Storage","SECTION_ID":4,"SECTION_HEADER":"FIRST AID MEASURES","SECTION_CONTENT":"Inhalation: If adverse effects occur, remove to uncontaminated area. Give artificial respiration if not breathing. If\nbreathing is difficult, oxygen should be administered by qualified personnel. If respiration or pulse has stopped, have a\ntrained person administer Basic Life Support (Cardio-Pulmonary Resuscitation/Automatic External Defibrillator) and CALL\nFOR EMERGENCY SERVICES IMMEDIATELY (911 or emergency transport services).\nSkin Contact: Immediately immerse contaminated areas under water. GET MEDICAL ATTENTION IMMEDIATELY.\nKeep contaminated area immersed in water until medical attention arrives. Remove contaminated clothing, jewelry and\nshoes. Discard contaminated clothing and footwear.\nEye Contact: Immediately flush eyes with a directed stream of water for at least 15 minutes, forcibly holding eyelids apart\nto ensure complete irrigation of all eye and lid tissues. Washing eyes within several seconds is essential to achieve\nmaximum effectiveness. GET MEDICAL ATTENTION IMMEDIATELY.\nIngestion: Never give anything by mouth to an unconscious or convulsive person. If swallowed, do not induce vomiting.\nGive large amounts of water. If vomiting occurs spontaneously, keep airway clear. Give more water when vomiting stops.\nGET MEDICAL ATTENTION IMMEDIATELY.","REVISED_CONTENT":"Product ID:HZ-WPH,Product Description:Phosphorus White,Storage Location:0002,Storage Location Description:Cold Storage,Plant:0001,Section Id:4,Section Header:FIRST AID MEASURES,Section Content:Inhalation: If adverse effects occur, remove to uncontaminated area. Give artificial respiration if not breathing. If\nbreathing is difficult, oxygen should be administered by qualified personnel. If respiration or pulse has stopped, have a\ntrained person administer Basic Life Support (Cardio-Pulmonary Resuscitation/Automatic External Defibrillator) and CALL\nFOR EMERGENCY SERVICES IMMEDIATELY (911 or emergency transport services).\nSkin Contact: Immediately immerse contaminated areas under water. GET MEDICAL ATTENTION IMMEDIATELY.\nKeep contaminated area immersed in water until medical attention arrives. Remove contaminated clothing, jewelry and\nshoes. Discard contaminated clothing and footwear.\nEye Contact: Immediately flush eyes with a directed stream of water for at least 15 minutes, forcibly holding eyelids apart\nto ensure complete irrigation of all eye and lid tissues. Washing eyes within several seconds is essential to achieve\nmaximum effectiveness. GET MEDICAL ATTENTION IMMEDIATELY.\nIngestion: Never give anything by mouth to an unconscious or convulsive person. If swallowed, do not induce vomiting.\nGive large amounts of water. If vomiting occurs spontaneously, keep airway clear. Give more water when vomiting stops.\nGET MEDICAL ATTENTION IMMEDIATELY."}