{"GUID":"AkKsEQACHt+eytMKHPHowg==","MATNR":"HZ-WPH","MAKTX":"Phosphorus White","WERKS":"0001","LGORT":"0088","LGOBE":"Lager 0088 (WM)","SECTION_ID":14,"SECTION_HEADER":"TRANSPORT INFORMATION","SECTION_CONTENT":"U.S.DOT 49 CFR 172.101:\nPROPER SHIPPING NAME: Phosphorus, white, under water\nDOT UN NUMBER:\nUN1381\nHAZARD CLASS/ DIVISION: 4.2\nPACKING GROUP:\nLABELING\nREQUIREMENTS:\nMARINE POLLUTANT:\nDOT RQ (lbs):\n4.2, 6.1\nPhosphorus, white, under water\nRQ 1 Lbs. (Phosphorus)\nCANADIAN TRANSPORTATION OF DANGEROUS GOODS:\nSHIPPING NAME:\nPHOSPHORUS, WHITE, UNDER WATER\nUN NUMBER:\nUN1381\nCLASS:\n4.2; 6.1\nPACKING/RISK GROUP:\nMARINE POLLUTANT:\nPhosphorus, white, under water\nOTHER INFORMATION:\nEmergency Response Assistance Plan (ERAP) may be required","REVISED_CONTENT":"Product ID:HZ-WPH,Product Description:Phosphorus White,Storage Location:0088,Storage Location Description:Lager 0088 (WM),Plant:0001,Section Id:14,Section Header:TRANSPORT INFORMATION,Section Content:U.S.DOT 49 CFR 172.101:\nPROPER SHIPPING NAME: Phosphorus, white, under water\nDOT UN NUMBER:\nUN1381\nHAZARD CLASS/ DIVISION: 4.2\nPACKING GROUP:\nLABELING\nREQUIREMENTS:\nMARINE POLLUTANT:\nDOT RQ (lbs):\n4.2, 6.1\nPhosphorus, white, under water\nRQ 1 Lbs. (Phosphorus)\nCANADIAN TRANSPORTATION OF DANGEROUS GOODS:\nSHIPPING NAME:\nPHOSPHORUS, WHITE, UNDER WATER\nUN NUMBER:\nUN1381\nCLASS:\n4.2; 6.1\nPACKING/RISK GROUP:\nMARINE POLLUTANT:\nPhosphorus, white, under water\nOTHER INFORMATION:\nEmergency Response Assistance Plan (ERAP) may be required"}