{"GUID":"AkKsEQACHt+eyqR2nb5owg==","MATNR":"HZ-CES","MAKTX":"Cesium","WERKS":"0001","LGORT":"0088","LGOBE":"Lager 0088 (WM)","SECTION_ID":2,"SECTION_HEADER":"Hazard identification","SECTION_CONTENT":"SECTION 2: Hazards identification\n2.1 Classification of the substance or mixture\nGHS Classification in accordance with 29 CFR 1910 (OSHA HCS)\nSubstances and mixtures which in contact with water emit flammable gases (Category 1),\nH260\nSkin corrosion (Category 1B), H314\nSerious eye damage (Category 1), H318\nFor the full text of the H-Statements mentioned in this Section, see Section 16.\n2.2 GHS Label elements, including precautionary statements\nPictogram\nSignal word\nDanger\nHazard statement(s)\nH260\nIn contact with water releases flammable gases which may\nignite spontaneously.\nH314\nCauses severe skin burns and eye damage.\nH318\nCauses serious eye damage.\nPrecautionary statement(s)\nP223\nKeep away from any possible contact with water, because of\nviolent reaction and possible flash fire.\nP231 + P232\nHandle under inert gas. Protect from moisture.\nP260\nDo not breathe dusts or mists.\nP264\nWash skin thoroughly after handling.\nP280\nWear protective gloves/ protective clothing/ eye protection/ face\nprotection.\nP301 + P330 + P331\nIF SWALLOWED: Rinse mouth. Do NOT induce vomiting.\nP303 + P361 + P353\nIF ON SKIN (or hair): Remove/ Take off immediately all\ncontaminated clothing. Rinse skin with water/ shower.\nP304 + P340 + P310\nIF INHALED: Remove victim to fresh air and keep at rest in a\nposition comfortable for breathing. Immediately call a POISON\nCENTER or doctor/ physician.\nP305 + P351 + P338 + P310\nIF IN EYES: Rinse cautiously with water for several minutes.\nRemove contact lenses, if present and easy to do. Continue\nrinsing. Immediately call a POISON CENTER/ doctor.\nP335 + P334\nBrush off loose particles from skin. Immerse in cool water/ wrap\nin wet bandages.\nP363\nWash contaminated clothing before reuse.\nP370 + P378\nIn case of fire: Use dry sand, dry chemical or alcohol-resistant\nfoam for extinction.\nP402 + P404\nStore in a dry place. Store in a closed container.\nP405\nStore locked up.\nP501\nDispose of contents/ container to an approved waste disposal\nplant.\n2.3 Hazards not otherwise classified (HNOC) or not covered by GHS\nReacts violently with water.","REVISED_CONTENT":"Product ID:HZ-CES,Product Description:Cesium,Storage Location:0088,Storage Location Description:Lager 0088 (WM),Plant:0001,Section Id:2,Section Header:Hazard identification,Section Content:SECTION 2: Hazards identification\n2.1 Classification of the substance or mixture\nGHS Classification in accordance with 29 CFR 1910 (OSHA HCS)\nSubstances and mixtures which in contact with water emit flammable gases (Category 1),\nH260\nSkin corrosion (Category 1B), H314\nSerious eye damage (Category 1), H318\nFor the full text of the H-Statements mentioned in this Section, see Section 16.\n2.2 GHS Label elements, including precautionary statements\nPictogram\nSignal word\nDanger\nHazard statement(s)\nH260\nIn contact with water releases flammable gases which may\nignite spontaneously.\nH314\nCauses severe skin burns and eye damage.\nH318\nCauses serious eye damage.\nPrecautionary statement(s)\nP223\nKeep away from any possible contact with water, because of\nviolent reaction and possible flash fire.\nP231 + P232\nHandle under inert gas. Protect from moisture.\nP260\nDo not breathe dusts or mists.\nP264\nWash skin thoroughly after handling.\nP280\nWear protective gloves/ protective clothing/ eye protection/ face\nprotection.\nP301 + P330 + P331\nIF SWALLOWED: Rinse mouth. Do NOT induce vomiting.\nP303 + P361 + P353\nIF ON SKIN (or hair): Remove/ Take off immediately all\ncontaminated clothing. Rinse skin with water/ shower.\nP304 + P340 + P310\nIF INHALED: Remove victim to fresh air and keep at rest in a\nposition comfortable for breathing. Immediately call a POISON\nCENTER or doctor/ physician.\nP305 + P351 + P338 + P310\nIF IN EYES: Rinse cautiously with water for several minutes.\nRemove contact lenses, if present and easy to do. Continue\nrinsing. Immediately call a POISON CENTER/ doctor.\nP335 + P334\nBrush off loose particles from skin. Immerse in cool water/ wrap\nin wet bandages.\nP363\nWash contaminated clothing before reuse.\nP370 + P378\nIn case of fire: Use dry sand, dry chemical or alcohol-resistant\nfoam for extinction.\nP402 + P404\nStore in a dry place. Store in a closed container.\nP405\nStore locked up.\nP501\nDispose of contents/ container to an approved waste disposal\nplant.\n2.3 Hazards not otherwise classified (HNOC) or not covered by GHS\nReacts violently with water."}