{"GUID":"AkKsEQACHt+eyqR2ncsowg==","MATNR":"HZ-GAS","MAKTX":"Gasoline","WERKS":"0001","LGORT":"0001","LGOBE":"Lager 0001","SECTION_ID":8,"SECTION_HEADER":"Exposure controls / personal protection","SECTION_CONTENT":"Exposure limits/standards (Note: Exposure limits are not additive)\nSubstance Name\nBenzene\nBenzene\nBenzene\nETHYL ALCOHOL\nETHYL TERT-BUTYL ETHER\nGASOLINE\nGASOLINE\nISOBUTYL ALCOHOL\nISOPROPYL ALCOHOL\nISOPROPYL ALCOHOL\nMETHYL ALCOHOL\nMETHYL ALCOHOL\nMETHYL-TERT-BUTYL ETHER\nTERT-BUTYL ALCOHOL\nToluene\nForm\nTWA\nSTEL\nTWA\nSTEL\nTWA\nSTEL\nTWA\nTWA\nSTEL\nTWA\nSTEL\nTWA\nTWA\nTWA\nTWA\nLimit/Standard\n3.25\n1\n0.5\n1000\n25\n200\n100\n50\n400\n200\n250\n200\n50\n100\n20\nNote\nSkin\nSkin\nSkin\nSource\nEU. Dir.\n04/37/EC\nAnnex III A\nExxonMobil\nExxonMobil\nACGIH\nACGIH\nExxonMobil\nExxonMobil\nACGIH\nACGIH\nACGIH\nACGIH\nACGIH\nACGIH\nACGIH\nACGIH\nYear\n2017\n2019\n2019\n2018\n2018\n2019\n2019\n2018\n2018\n2018\n2018\n2018\n2018\n2018\n2018\nmg/m3\nppm\nppm\nppm\nppm\nppm\nppm\nppm\nppm\nppm\nppm\nppm\nppm\nppm\nppm\nppm\n1 ppm\n1 ppm\n0.5 ppm\n1000 ppm\n25 ppm\n200 ppm\n100 ppm\n50 ppm\n400 ppm\n200 ppm\n250 ppm\n200 ppm\n50 ppm\n100 ppm\n20 ppm\nBiological limits\nSubstance Name\nBenzene\nSpecimen\nCreatinine in\nurine\nSampling Time Limit\nEnd of shift\nDeterminant\nt,t-Muconic acid\nSource\nACGIH BELS\n(BEIs)","REVISED_CONTENT":"Product ID:HZ-GAS,Product Description:Gasoline,Storage Location:0001,Storage Location Description:Lager 0001,Plant:0001,Section Id:8,Section Header:Exposure controls / personal protection,Section Content:Exposure limits/standards (Note: Exposure limits are not additive)\nSubstance Name\nBenzene\nBenzene\nBenzene\nETHYL ALCOHOL\nETHYL TERT-BUTYL ETHER\nGASOLINE\nGASOLINE\nISOBUTYL ALCOHOL\nISOPROPYL ALCOHOL\nISOPROPYL ALCOHOL\nMETHYL ALCOHOL\nMETHYL ALCOHOL\nMETHYL-TERT-BUTYL ETHER\nTERT-BUTYL ALCOHOL\nToluene\nForm\nTWA\nSTEL\nTWA\nSTEL\nTWA\nSTEL\nTWA\nTWA\nSTEL\nTWA\nSTEL\nTWA\nTWA\nTWA\nTWA\nLimit/Standard\n3.25\n1\n0.5\n1000\n25\n200\n100\n50\n400\n200\n250\n200\n50\n100\n20\nNote\nSkin\nSkin\nSkin\nSource\nEU. Dir.\n04/37/EC\nAnnex III A\nExxonMobil\nExxonMobil\nACGIH\nACGIH\nExxonMobil\nExxonMobil\nACGIH\nACGIH\nACGIH\nACGIH\nACGIH\nACGIH\nACGIH\nACGIH\nYear\n2017\n2019\n2019\n2018\n2018\n2019\n2019\n2018\n2018\n2018\n2018\n2018\n2018\n2018\n2018\nmg/m3\nppm\nppm\nppm\nppm\nppm\nppm\nppm\nppm\nppm\nppm\nppm\nppm\nppm\nppm\nppm\n1 ppm\n1 ppm\n0.5 ppm\n1000 ppm\n25 ppm\n200 ppm\n100 ppm\n50 ppm\n400 ppm\n200 ppm\n250 ppm\n200 ppm\n50 ppm\n100 ppm\n20 ppm\nBiological limits\nSubstance Name\nBenzene\nSpecimen\nCreatinine in\nurine\nSampling Time Limit\nEnd of shift\nDeterminant\nt,t-Muconic acid\nSource\nACGIH BELS\n(BEIs)"}