{"GUID":"AkKsEQACHt+eytMKHPEIwg==","MATNR":"HZ-WPH","MAKTX":"Phosphorus White","WERKS":"0001","LGORT":"0088","LGOBE":"Lager 0088 (WM)","SECTION_ID":7,"SECTION_HEADER":"HANDLING AND STORAGE","SECTION_CONTENT":"Storage Conditions: Store and handle in accordance with all current regulations and standards. Store under water and\nan inert gas. Keep container tightly closed and properly labeled. Keep in a well-ventilated area away from incompatible\nmaterials.\nHandling Procedures: Handle under water. Avoid breathing vapors. Do not get in eyes, on skin, or on clothing. Use\nforceps to handle small quantities of frozen phosphorus. Wash thoroughly with soap and water after handling.","REVISED_CONTENT":"Product ID:HZ-WPH,Product Description:Phosphorus White,Storage Location:0088,Storage Location Description:Lager 0088 (WM),Plant:0001,Section Id:7,Section Header:HANDLING AND STORAGE,Section Content:Storage Conditions: Store and handle in accordance with all current regulations and standards. Store under water and\nan inert gas. Keep container tightly closed and properly labeled. Keep in a well-ventilated area away from incompatible\nmaterials.\nHandling Procedures: Handle under water. Avoid breathing vapors. Do not get in eyes, on skin, or on clothing. Use\nforceps to handle small quantities of frozen phosphorus. Wash thoroughly with soap and water after handling."}