{"GUID":"AkKsEQACHt+eyqR2qBrowg==","MATNR":"HZ-PPM","MAKTX":"Potassium permanganate","WERKS":"0001","LGORT":"0088","LGOBE":"Lager 0088 (WM)","SECTION_ID":16,"SECTION_HEADER":"Other information","SECTION_CONTENT":"This product does not contain any Proposition 65 chemicals.\nComponent\nPotassium permanganate\nReportable Quantity (RQ):\nDOT Marine Pollutant\nDOT Severe Marine Pollutant\nComponent\nPotassium permanganate\nComponent\nPotassium permanganate\nComponent\nPotassium permanganate\nMassachusetts\nX\nNew Jersey\nX\nPennsylvania\nX\nIllinois\nX\nRhode Island\nX\nY\nN\nN\nDHS Chemical Facility Anti-Terrorism Standard\nTheft STQs - 400lb\nREACH (1907/2006) - Annex XIV\nSubstances Subject to\nAuthorization\nREACH (1907/2006) - Annex XVII -\nRestrictions on Certain Dangerous\nSubstances\nUse restricted. See item 75.\n(see link for restriction details)\nREACH Regulation (EC\n1907/2006) article 59 - Candidate\nList of Substances of Very High\nConcern (SVHC)\nhttps://echa.europa.eu/substances-restricted-under-reach\nCAS No\n7722-64-7\nCAS No\n7722-64-7\nOECD HPV\nListed\nSeveso III Directive\n(2012/18/EC) -\nQualifying Quantities\nfor Major Accident\nNotification\nNot applicable\nSeveso III Directive\n(2012/18/EC) -\nQualifying Quantities\nfor Safety Report\nRequirements\nNot applicable\nPersistent Organic\nPollutant\nNot applicable\nOzone Depletion\nPotential\nNot applicable\nRotterdam\nRestriction of\nHazardous\nSubstances (RoHS)\nNot applicable\nBasel Convention\nConvention (PIC) (Hazardous Waste)\nNot applicable\nRegulatory Affairs\nThermo Fisher Scientific\nEmail: EMSDS.RA@thermofisher.com\n23-Oct-2009\n24-Dec-2021\n24-Dec-2021\nThis document has been updated to comply with the US OSHA HazCom 2012 Standard\nreplacing the current legislation under 29 CFR 1910.1200 to align with the Globally\nHarmonized System of Classification and Labeling of Chemicals (GHS).","REVISED_CONTENT":"Product ID:HZ-PPM,Product Description:Potassium permanganate,Storage Location:0088,Storage Location Description:Lager 0088 (WM),Plant:0001,Section Id:16,Section Header:Other information,Section Content:This product does not contain any Proposition 65 chemicals.\nComponent\nPotassium permanganate\nReportable Quantity (RQ):\nDOT Marine Pollutant\nDOT Severe Marine Pollutant\nComponent\nPotassium permanganate\nComponent\nPotassium permanganate\nComponent\nPotassium permanganate\nMassachusetts\nX\nNew Jersey\nX\nPennsylvania\nX\nIllinois\nX\nRhode Island\nX\nY\nN\nN\nDHS Chemical Facility Anti-Terrorism Standard\nTheft STQs - 400lb\nREACH (1907/2006) - Annex XIV\nSubstances Subject to\nAuthorization\nREACH (1907/2006) - Annex XVII -\nRestrictions on Certain Dangerous\nSubstances\nUse restricted. See item 75.\n(see link for restriction details)\nREACH Regulation (EC\n1907/2006) article 59 - Candidate\nList of Substances of Very High\nConcern (SVHC)\nhttps://echa.europa.eu/substances-restricted-under-reach\nCAS No\n7722-64-7\nCAS No\n7722-64-7\nOECD HPV\nListed\nSeveso III Directive\n(2012/18/EC) -\nQualifying Quantities\nfor Major Accident\nNotification\nNot applicable\nSeveso III Directive\n(2012/18/EC) -\nQualifying Quantities\nfor Safety Report\nRequirements\nNot applicable\nPersistent Organic\nPollutant\nNot applicable\nOzone Depletion\nPotential\nNot applicable\nRotterdam\nRestriction of\nHazardous\nSubstances (RoHS)\nNot applicable\nBasel Convention\nConvention (PIC) (Hazardous Waste)\nNot applicable\nRegulatory Affairs\nThermo Fisher Scientific\nEmail: EMSDS.RA@thermofisher.com\n23-Oct-2009\n24-Dec-2021\n24-Dec-2021\nThis document has been updated to comply with the US OSHA HazCom 2012 Standard\nreplacing the current legislation under 29 CFR 1910.1200 to align with the Globally\nHarmonized System of Classification and Labeling of Chemicals (GHS)."}