{"GUID":"AkKsEQACHt+eyqR2oXMowg==","MATNR":"HZ-MET","MAKTX":"Methane","WERKS":"0001","LGORT":"0001","LGOBE":"Lager 0001","SECTION_ID":2,"SECTION_HEADER":"Hazards identification","SECTION_CONTENT":"OSHA/HCS status : This material is considered hazardous by the OSHA Hazard Communication Standard\n(29 CFR 1910.1200).\nClassification of the\nsubstance or mixture : FLAMMABLE GASES - Category 1\nGASES UNDER PRESSURE - Compressed gas\nGHS label elements\nHazard pictograms : \nSignal word : Danger\nHazard statements : Extremely flammable gas.\nMay form explosive mixtures with air.\nContains gas under pressure; may explode if heated.\nMay displace oxygen and cause rapid suffocation.\nPrecautionary statements\nGeneral : Read and follow all Safety Data Sheets (SDS'S) before use. Read label before use.\nKeep out of reach of children. If medical advice is needed, have product container or\nlabel at hand. Close valve after each use and when empty. Use equipment rated for\ncylinder pressure. Do not open valve until connected to equipment prepared for use.\nUse a back flow preventative device in the piping. Use only equipment of compatible\nmaterials of construction. Approach suspected leak area with caution.\nPrevention : Keep away from heat, hot surfaces, sparks, open flames and other ignition sources. No\nsmoking.\nResponse : Leaking gas fire: Do not extinguish, unless leak can be stopped safely. Eliminate all\nignition sources if safe to do so.\nStorage : Protect from sunlight. Store in a well-ventilated place.\nDisposal : Not applicable.\nHazards not otherwise\nclassified : In addition to any other important health or physical hazards, this product may displace\noxygen and cause rapid suffocation.","REVISED_CONTENT":"Product ID:HZ-MET,Product Description:Methane,Storage Location:0001,Storage Location Description:Lager 0001,Plant:0001,Section Id:2,Section Header:Hazards identification,Section Content:OSHA/HCS status : This material is considered hazardous by the OSHA Hazard Communication Standard\n(29 CFR 1910.1200).\nClassification of the\nsubstance or mixture : FLAMMABLE GASES - Category 1\nGASES UNDER PRESSURE - Compressed gas\nGHS label elements\nHazard pictograms : \nSignal word : Danger\nHazard statements : Extremely flammable gas.\nMay form explosive mixtures with air.\nContains gas under pressure; may explode if heated.\nMay displace oxygen and cause rapid suffocation.\nPrecautionary statements\nGeneral : Read and follow all Safety Data Sheets (SDS'S) before use. Read label before use.\nKeep out of reach of children. If medical advice is needed, have product container or\nlabel at hand. Close valve after each use and when empty. Use equipment rated for\ncylinder pressure. Do not open valve until connected to equipment prepared for use.\nUse a back flow preventative device in the piping. Use only equipment of compatible\nmaterials of construction. Approach suspected leak area with caution.\nPrevention : Keep away from heat, hot surfaces, sparks, open flames and other ignition sources. No\nsmoking.\nResponse : Leaking gas fire: Do not extinguish, unless leak can be stopped safely. Eliminate all\nignition sources if safe to do so.\nStorage : Protect from sunlight. Store in a well-ventilated place.\nDisposal : Not applicable.\nHazards not otherwise\nclassified : In addition to any other important health or physical hazards, this product may displace\noxygen and cause rapid suffocation."}