{"GUID":"AkKsEQACHt+eytMKHO9Iwg==","MATNR":"HZ-WPH","MAKTX":"Phosphorus White","WERKS":"0001","LGORT":"0002","LGOBE":"Cold Storage","SECTION_ID":9,"SECTION_HEADER":"PHYSICAL AND CHEMICAL PROPERTIES","SECTION_CONTENT":"Physical State:\nSolid\nAppearance:\nWaxy\nColor:\nColorless to yellow\nOdor:\nOdorless when not exposed to air\nMolecular Weight:\n123.88\nMolecular Formula:\nP4\nBoiling Point/Range:\nNot applicable\nMelting Point/Range:\n111 F (44 C)\nVapor Pressure:\n0.026 mmHg @ 20 C\nVapor Density (air=1):\n4.66\nSpecific Gravity (water=1):\n1.83 @ 25 C\nWater Solubility:\n3 ppm @ 20 ะก\nPartition Coefficient (n-\nLog Kow = 3.08\nocta","REVISED_CONTENT":"Product ID:HZ-WPH,Product Description:Phosphorus White,Storage Location:0002,Storage Location Description:Cold Storage,Plant:0001,Section Id:9,Section Header:PHYSICAL AND CHEMICAL PROPERTIES,Section Content:Physical State:\nSolid\nAppearance:\nWaxy\nColor:\nColorless to yellow\nOdor:\nOdorless when not exposed to air\nMolecular Weight:\n123.88\nMolecular Formula:\nP4\nBoiling Point/Range:\nNot applicable\nMelting Point/Range:\n111 F (44 C)\nVapor Pressure:\n0.026 mmHg @ 20 C\nVapor Density (air=1):\n4.66\nSpecific Gravity (water=1):\n1.83 @ 25 C\nWater Solubility:\n3 ppm @ 20 ะก\nPartition Coefficient (n-\nLog Kow = 3.08\nocta"}