{"GUID":"AkKsEQACHt+eytMKHPAIwg==","MATNR":"HZ-WPH","MAKTX":"Phosphorus White","WERKS":"0001","LGORT":"0002","LGOBE":"Cold Storage","SECTION_ID":15,"SECTION_HEADER":"REGULATORY INFORMATION","SECTION_CONTENT":"U.S. REGULATIONS\nOSHA REGULATORY STATUS: This material is considered hazardous by the OSHA Hazard Communication\nStandard (29 CFR 1910.1200) (US).\nCERCLA SECTIONS 102a/103 HAZARDOUS SUBSTANCES (40 CFR 302.4): If a release is reportable under\nCERCLA section 103, notify the state emergency response commission and local emergency planning committee.\nIn addition, notify the National Response Center at (800) 424-8802 or (202) 426-2675.\nHazardous Component\nCERCLA Reportable Quantities:\nPhosphorus\n1 lb (final RQ)\nEPCRA EXTREMELY HAZARDOUS SUBSTANCES (40 CFR 355.30): If a release is reportable under EPCRA,\nnotify the state emergency response commission and local emergency planning committee. If the TPQ is met,\nfacilities are subject to reporting requirements under EPCRA Sections 311 and 312.\nHazardous Component\nEPCRA RQS\nThreshold Planning Quantity (TPQs)\nPhosphorus\n1 lb (EPCRA RQ)\n100 lb (TPQ)\nEPCRA SECTIONS 311/312 HAZARD CATEGORIES (40 CFR 370.21):\nFire Hazard, Acute Health Hazard, Chronic Health Hazard, Extremely Hazardous\nEPCRA SECTION 313 (40 CFR 372.65): The following chemicals are listed in 40 CFR 372.65 and may be subject\nto Community Right-to Know Reporting requirements:\nHazardous Component\nStatus:\nPhosphorus\nListed\nDEPARTMENT OF HOMELAND SECURITY - Chemical Facility Anti-Terrorism Standards (6 CFR 27): The\nDepartment of Homeland Security identifies phosphorus as a chemical of interest. Unless otherwise exempted,\nfacilities that process quantities in excess of the Screening Threshold Quantity (STQ) must submit a Top-Screen to\naid the DHS in determining if the facility presents a high level of security risk. The STQ for phosphorus is 400\npounds.\nOSHA PROCESS SAFETY (29 CFR 1910.119): Not regulated","REVISED_CONTENT":"Product ID:HZ-WPH,Product Description:Phosphorus White,Storage Location:0002,Storage Location Description:Cold Storage,Plant:0001,Section Id:15,Section Header:REGULATORY INFORMATION,Section Content:U.S. REGULATIONS\nOSHA REGULATORY STATUS: This material is considered hazardous by the OSHA Hazard Communication\nStandard (29 CFR 1910.1200) (US).\nCERCLA SECTIONS 102a/103 HAZARDOUS SUBSTANCES (40 CFR 302.4): If a release is reportable under\nCERCLA section 103, notify the state emergency response commission and local emergency planning committee.\nIn addition, notify the National Response Center at (800) 424-8802 or (202) 426-2675.\nHazardous Component\nCERCLA Reportable Quantities:\nPhosphorus\n1 lb (final RQ)\nEPCRA EXTREMELY HAZARDOUS SUBSTANCES (40 CFR 355.30): If a release is reportable under EPCRA,\nnotify the state emergency response commission and local emergency planning committee. If the TPQ is met,\nfacilities are subject to reporting requirements under EPCRA Sections 311 and 312.\nHazardous Component\nEPCRA RQS\nThreshold Planning Quantity (TPQs)\nPhosphorus\n1 lb (EPCRA RQ)\n100 lb (TPQ)\nEPCRA SECTIONS 311/312 HAZARD CATEGORIES (40 CFR 370.21):\nFire Hazard, Acute Health Hazard, Chronic Health Hazard, Extremely Hazardous\nEPCRA SECTION 313 (40 CFR 372.65): The following chemicals are listed in 40 CFR 372.65 and may be subject\nto Community Right-to Know Reporting requirements:\nHazardous Component\nStatus:\nPhosphorus\nListed\nDEPARTMENT OF HOMELAND SECURITY - Chemical Facility Anti-Terrorism Standards (6 CFR 27): The\nDepartment of Homeland Security identifies phosphorus as a chemical of interest. Unless otherwise exempted,\nfacilities that process quantities in excess of the Screening Threshold Quantity (STQ) must submit a Top-Screen to\naid the DHS in determining if the facility presents a high level of security risk. The STQ for phosphorus is 400\npounds.\nOSHA PROCESS SAFETY (29 CFR 1910.119): Not regulated"}