{"GUID":"AkKsEQACHt+eytMKHPIowg==","MATNR":"HZ-WPH","MAKTX":"Phosphorus White","WERKS":"0001","LGORT":"0088","LGOBE":"Lager 0088 (WM)","SECTION_ID":16,"SECTION_HEADER":"OTHER INFORMATION","SECTION_CONTENT":"IMPORTANT:\nThe information presented herein, while not guaranteed, was prepared by competent technical personnel and is true and\naccurate to the best of our knowledge. NO WARRANTY OF MERCHANTABILITY OR OF FITNESS FOR A\nPARTICULAR PURPOSE, OR WARRANTY OR GUARANTY OF ANY OTHER KIND, EXPRESS OR IMPLIED, IS MADE\nREGARDING PERFORMANCE, SUITABILITY, STABILITY OR OTHERWISE. The information included herein is not\nintended to be all-inclusive as to the appropriate manner and/or conditions of use, handling and/or storage. Factors\npertaining to certain conditions of storage, handling, or use of this product may involve other or additional safety or\nperformance considerations. While our technical personnel will be happy to respond to questions regarding safe handling\nand use procedures, safe handling and use remains the responsibility of the customer. No suggestions for use are\nintended to, and nothing herein shall be construed as a recommendation to, infringe any existing patents or violate any\nlaws, rules, regulations or ordinances of any governmental entity.\nStandard 29 CFR 1910.1200 requires that information be provided to employees regarding the hazard of chemicals by\nmeans of a hazard communication program including labeling, material safety data sheets, training and access to written\nrecords. We request that you, and it is your legal duty to, make all information in this Material Safety Data Sheet available\nto your employees.","REVISED_CONTENT":"Product ID:HZ-WPH,Product Description:Phosphorus White,Storage Location:0088,Storage Location Description:Lager 0088 (WM),Plant:0001,Section Id:16,Section Header:OTHER INFORMATION,Section Content:IMPORTANT:\nThe information presented herein, while not guaranteed, was prepared by competent technical personnel and is true and\naccurate to the best of our knowledge. NO WARRANTY OF MERCHANTABILITY OR OF FITNESS FOR A\nPARTICULAR PURPOSE, OR WARRANTY OR GUARANTY OF ANY OTHER KIND, EXPRESS OR IMPLIED, IS MADE\nREGARDING PERFORMANCE, SUITABILITY, STABILITY OR OTHERWISE. The information included herein is not\nintended to be all-inclusive as to the appropriate manner and/or conditions of use, handling and/or storage. Factors\npertaining to certain conditions of storage, handling, or use of this product may involve other or additional safety or\nperformance considerations. While our technical personnel will be happy to respond to questions regarding safe handling\nand use procedures, safe handling and use remains the responsibility of the customer. No suggestions for use are\nintended to, and nothing herein shall be construed as a recommendation to, infringe any existing patents or violate any\nlaws, rules, regulations or ordinances of any governmental entity.\nStandard 29 CFR 1910.1200 requires that information be provided to employees regarding the hazard of chemicals by\nmeans of a hazard communication program including labeling, material safety data sheets, training and access to written\nrecords. We request that you, and it is your legal duty to, make all information in this Material Safety Data Sheet available\nto your employees."}