{"GUID":"AkKsEQACHt+eytMKHPGowg==","MATNR":"HZ-WPH","MAKTX":"Phosphorus White","WERKS":"0001","LGORT":"0088","LGOBE":"Lager 0088 (WM)","SECTION_ID":12,"SECTION_HEADER":"ECOLOGICAL INFORMATION","SECTION_CONTENT":"AQUATIC TOXICITY: Harmful to Aquatic Organisms.\nFreshwater Fish Data:\nLC50 channel catfish: 73 ug/L/96 hr\nLC50 rainbow trout: 22 ug/L/96 hr\nLC50 fathead minnow: 20 ug/L/96 hr\nLC50 bluegill sunfish: 6 ug/L/96 hr\nInvertebrate Toxicity Data:\nEC50 daphnia magna: 30 ug/L/48 hr\nEC50 scud: 250 ug/L/48 hr\nFATE AND TRANSPORT: Particles will settle due to gravitational forces an may sorb to particulate matter in water and\nbe transported to sediment. Volatilization from water to air is another mode of transport.\nPERSISTENCE: Will not persist. The estimated half-lives at ambient temperatures due to a combination of hydrolysis\nand oxidation reactions were 42 hours in air-saturated water and 56 hours in non air-saturated water.\nBIOCONCENTRATION: This material moderately bioconcentrates in aquatic organisms. Bioconcentration factors for\nspecies tested ranged from 22 to 127. Elimination was rapid when the organism was placed in clean water.\nADDITIONAL ECOLOGICAL INFORMATION: This material has exhibited slight toxicity to terrestrial organisms.","REVISED_CONTENT":"Product ID:HZ-WPH,Product Description:Phosphorus White,Storage Location:0088,Storage Location Description:Lager 0088 (WM),Plant:0001,Section Id:12,Section Header:ECOLOGICAL INFORMATION,Section Content:AQUATIC TOXICITY: Harmful to Aquatic Organisms.\nFreshwater Fish Data:\nLC50 channel catfish: 73 ug/L/96 hr\nLC50 rainbow trout: 22 ug/L/96 hr\nLC50 fathead minnow: 20 ug/L/96 hr\nLC50 bluegill sunfish: 6 ug/L/96 hr\nInvertebrate Toxicity Data:\nEC50 daphnia magna: 30 ug/L/48 hr\nEC50 scud: 250 ug/L/48 hr\nFATE AND TRANSPORT: Particles will settle due to gravitational forces an may sorb to particulate matter in water and\nbe transported to sediment. Volatilization from water to air is another mode of transport.\nPERSISTENCE: Will not persist. The estimated half-lives at ambient temperatures due to a combination of hydrolysis\nand oxidation reactions were 42 hours in air-saturated water and 56 hours in non air-saturated water.\nBIOCONCENTRATION: This material moderately bioconcentrates in aquatic organisms. Bioconcentration factors for\nspecies tested ranged from 22 to 127. Elimination was rapid when the organism was placed in clean water.\nADDITIONAL ECOLOGICAL INFORMATION: This material has exhibited slight toxicity to terrestrial organisms."}