{"GUID":"AkKsEQACHt+eyqR2oXRIwg==","MATNR":"HZ-MET","MAKTX":"Methane","WERKS":"0001","LGORT":"0001","LGOBE":"Lager 0001","SECTION_ID":11,"SECTION_HEADER":"Toxicological information","SECTION_CONTENT":"Information on toxicological effects\nAcute toxicity\nNot available.\nIrritation/Corrosion\nNot available.\nSensitization\nNot available.\nMutagenicity\nNot available.\nCarcinogenicity\nNot available.\nReproductive toxicity\nNot available.\nTeratogenicity\nNot available.\nSpecific target organ toxicity (single exposure)\nNot available.\nSpecific target organ toxicity (repeated exposure)\nNot available.\nAspiration hazard\nNot available.\nInformation on the likely\nroutes of exposure\nPotential acute health effects\nEye contact : Contact with rapidly expanding gas may cause burns or frostbite.\nInhalation : As this product is a gas, refer to the inhalation section.\nSkin contact : Contact with rapidly expanding gas may cause burns or frostbite.\nIngestion : As this product is a gas, refer to the inhalation section.\nSymptoms related to the physical, chemical and toxicological characteristics\nEye contact : No specific data.\nInhalation : No specific data.\nSkin contact : No specific data.\nIngestion : No specific data.\nDelayed and immediate effects and also chronic effects from short and long term exposure\nShort term exposure : Not available.\nPotential immediate\neffects : Not available.\nPotential delayed effects : Not available.\nLong term exposure : Not available.\nPotential immediate\neffects : Not available.\nPotential delayed effects : Not available.\nPotential chronic health effects\nNot available.\nGeneral : No known significant effects or critical hazards.\nCarcinogenicity : No known significant effects or critical hazards.\nMutagenicity : No known significant effects or critical hazards.\nTeratogenicity : No known significant effects or critical hazards.\nDevelopmental effects : No known significant effects or critical hazards.\nFertility effects : No known significant effects or critical hazards.\nNumerical measures of toxicity\nAcute toxicity estimates\nNot available.","REVISED_CONTENT":"Product ID:HZ-MET,Product Description:Methane,Storage Location:0001,Storage Location Description:Lager 0001,Plant:0001,Section Id:11,Section Header:Toxicological information,Section Content:Information on toxicological effects\nAcute toxicity\nNot available.\nIrritation/Corrosion\nNot available.\nSensitization\nNot available.\nMutagenicity\nNot available.\nCarcinogenicity\nNot available.\nReproductive toxicity\nNot available.\nTeratogenicity\nNot available.\nSpecific target organ toxicity (single exposure)\nNot available.\nSpecific target organ toxicity (repeated exposure)\nNot available.\nAspiration hazard\nNot available.\nInformation on the likely\nroutes of exposure\nPotential acute health effects\nEye contact : Contact with rapidly expanding gas may cause burns or frostbite.\nInhalation : As this product is a gas, refer to the inhalation section.\nSkin contact : Contact with rapidly expanding gas may cause burns or frostbite.\nIngestion : As this product is a gas, refer to the inhalation section.\nSymptoms related to the physical, chemical and toxicological characteristics\nEye contact : No specific data.\nInhalation : No specific data.\nSkin contact : No specific data.\nIngestion : No specific data.\nDelayed and immediate effects and also chronic effects from short and long term exposure\nShort term exposure : Not available.\nPotential immediate\neffects : Not available.\nPotential delayed effects : Not available.\nLong term exposure : Not available.\nPotential immediate\neffects : Not available.\nPotential delayed effects : Not available.\nPotential chronic health effects\nNot available.\nGeneral : No known significant effects or critical hazards.\nCarcinogenicity : No known significant effects or critical hazards.\nMutagenicity : No known significant effects or critical hazards.\nTeratogenicity : No known significant effects or critical hazards.\nDevelopmental effects : No known significant effects or critical hazards.\nFertility effects : No known significant effects or critical hazards.\nNumerical measures of toxicity\nAcute toxicity estimates\nNot available."}